<?xml version="1.0"?>
<?xml-stylesheet type="text/xsl" href="pdml2html.xsl"?>
<!-- You can find pdml2html.xsl in /home/dlacewell/apps/wireshark-1.8.4 or at http://anonsvn.wireshark.org/trunk/wireshark/pdml2html.xsl. -->
<pdml version="0" creator="wireshark/1.8.4" time="Tue Jan  8 12:03:47 2013" capture_file="/home/dlacewell/go/kgs protocol/packets">
<packet>
  <proto name="geninfo" pos="0" showname="General information" size="74">
    <field name="num" pos="0" show="1" showname="Number" value="1" size="74"/>
    <field name="len" pos="0" show="74" showname="Frame Length" value="4a" size="74"/>
    <field name="caplen" pos="0" show="74" showname="Captured Length" value="4a" size="74"/>
    <field name="timestamp" pos="0" show="Jan  7, 2013 14:30:18.379503000 CST" showname="Captured Time" value="1357590618.379503000" size="74"/>
  </proto>
  <proto name="frame" showname="Frame 1: 74 bytes on wire (592 bits), 74 bytes captured (592 bits)" size="74" pos="0">
    <field name="frame.dlt" showname="WTAP_ENCAP: 1" size="0" pos="0" show="1"/>
    <field name="frame.time" showname="Arrival Time: Jan  7, 2013 14:30:18.379503000 CST" size="0" pos="0" show="Jan  7, 2013 14:30:18.379503000"/>
    <field name="frame.offset_shift" showname="Time shift for this packet: 0.000000000 seconds" size="0" pos="0" show="0.000000000"/>
    <field name="frame.time_epoch" showname="Epoch Time: 1357590618.379503000 seconds" size="0" pos="0" show="1357590618.379503000"/>
    <field name="frame.time_delta" showname="Time delta from previous captured frame: 0.000000000 seconds" size="0" pos="0" show="0.000000000"/>
    <field name="frame.time_delta_displayed" showname="Time delta from previous displayed frame: 0.000000000 seconds" size="0" pos="0" show="0.000000000"/>
    <field name="frame.time_relative" showname="Time since reference or first frame: 0.000000000 seconds" size="0" pos="0" show="0.000000000"/>
    <field name="frame.number" showname="Frame Number: 1" size="0" pos="0" show="1"/>
    <field name="frame.len" showname="Frame Length: 74 bytes (592 bits)" size="0" pos="0" show="74"/>
    <field name="frame.cap_len" showname="Capture Length: 74 bytes (592 bits)" size="0" pos="0" show="74"/>
    <field name="frame.marked" showname="Frame is marked: False" size="0" pos="0" show="0"/>
    <field name="frame.ignored" showname="Frame is ignored: False" size="0" pos="0" show="0"/>
    <field name="frame.protocols" showname="Protocols in frame: eth:ip:tcp" size="0" pos="0" show="eth:ip:tcp"/>
    <field name="frame.coloring_rule.name" showname="Coloring Rule Name: TCP SYN/FIN" size="0" pos="0" show="TCP SYN/FIN"/>
    <field name="frame.coloring_rule.string" showname="Coloring Rule String: tcp.flags &amp; 0x02 || tcp.flags.fin == 1" size="0" pos="0" show="tcp.flags &amp; 0x02 || tcp.flags.fin == 1"/>
  </proto>
  <proto name="eth" showname="Ethernet II, Src: QuantaCo_aa:bb:43 (c8:0a:a9:aa:bb:43), Dst: Cisco_82:44:2f (00:13:c4:82:44:2f)" size="14" pos="0">
    <field name="eth.dst" showname="Destination: Cisco_82:44:2f (00:13:c4:82:44:2f)" size="6" pos="0" show="00:13:c4:82:44:2f" value="0013c482442f">
      <field name="eth.addr" showname="Address: Cisco_82:44:2f (00:13:c4:82:44:2f)" size="6" pos="0" show="00:13:c4:82:44:2f" value="0013c482442f"/>
      <field name="eth.lg" showname=".... ..0. .... .... .... .... = LG bit: Globally unique address (factory default)" size="3" pos="0" show="0" value="0" unmaskedvalue="0013c4"/>
      <field name="eth.ig" showname=".... ...0 .... .... .... .... = IG bit: Individual address (unicast)" size="3" pos="0" show="0" value="0" unmaskedvalue="0013c4"/>
    </field>
    <field name="eth.src" showname="Source: QuantaCo_aa:bb:43 (c8:0a:a9:aa:bb:43)" size="6" pos="6" show="c8:0a:a9:aa:bb:43" value="c80aa9aabb43">
      <field name="eth.addr" showname="Address: QuantaCo_aa:bb:43 (c8:0a:a9:aa:bb:43)" size="6" pos="6" show="c8:0a:a9:aa:bb:43" value="c80aa9aabb43"/>
      <field name="eth.lg" showname=".... ..0. .... .... .... .... = LG bit: Globally unique address (factory default)" size="3" pos="6" show="0" value="0" unmaskedvalue="c80aa9"/>
      <field name="eth.ig" showname=".... ...0 .... .... .... .... = IG bit: Individual address (unicast)" size="3" pos="6" show="0" value="0" unmaskedvalue="c80aa9"/>
    </field>
    <field name="eth.type" showname="Type: IP (0x0800)" size="2" pos="12" show="0x0800" value="0800"/>
  </proto>
  <proto name="ip" showname="Internet Protocol Version 4, Src: 192.168.0.104 (192.168.0.104), Dst: 69.167.162.200 (69.167.162.200)" size="20" pos="14">
    <field name="ip.version" showname="Version: 4" size="1" pos="14" show="4" value="45"/>
    <field name="ip.hdr_len" showname="Header length: 20 bytes" size="1" pos="14" show="20" value="45"/>
    <field name="ip.dsfield" showname="Differentiated Services Field: 0x00 (DSCP 0x00: Default; ECN: 0x00: Not-ECT (Not ECN-Capable Transport))" size="1" pos="15" show="0" value="00">
      <field name="ip.dsfield.dscp" showname="0000 00.. = Differentiated Services Codepoint: Default (0x00)" size="1" pos="15" show="0x00" value="0" unmaskedvalue="00"/>
      <field name="ip.dsfield.ecn" showname=".... ..00 = Explicit Congestion Notification: Not-ECT (Not ECN-Capable Transport) (0x00)" size="1" pos="15" show="0x00" value="0" unmaskedvalue="00"/>
    </field>
    <field name="ip.len" showname="Total Length: 60" size="2" pos="16" show="60" value="003c"/>
    <field name="ip.id" showname="Identification: 0xec50 (60496)" size="2" pos="18" show="0xec50" value="ec50"/>
    <field name="ip.flags" showname="Flags: 0x02 (Don&apos;t Fragment)" size="1" pos="20" show="0x02" value="40">
      <field name="ip.flags.rb" showname="0... .... = Reserved bit: Not set" size="1" pos="20" show="0" value="40"/>
      <field name="ip.flags.df" showname=".1.. .... = Don&apos;t fragment: Set" size="1" pos="20" show="1" value="40"/>
      <field name="ip.flags.mf" showname="..0. .... = More fragments: Not set" size="1" pos="20" show="0" value="40"/>
    </field>
    <field name="ip.frag_offset" showname="Fragment offset: 0" size="2" pos="20" show="0" value="4000"/>
    <field name="ip.ttl" showname="Time to live: 64" size="1" pos="22" show="64" value="40"/>
    <field name="ip.proto" showname="Protocol: TCP (6)" size="1" pos="23" show="6" value="06"/>
    <field name="ip.checksum" showname="Header checksum: 0xa4eb [correct]" size="2" pos="24" show="0xa4eb" value="a4eb">
      <field name="ip.checksum_good" showname="Good: True" size="2" pos="24" show="1" value="a4eb"/>
      <field name="ip.checksum_bad" showname="Bad: False" size="2" pos="24" show="0" value="a4eb"/>
    </field>
    <field name="ip.src" showname="Source: 192.168.0.104 (192.168.0.104)" size="4" pos="26" show="192.168.0.104" value="c0a80068"/>
    <field name="ip.addr" showname="Source or Destination Address: 192.168.0.104 (192.168.0.104)" hide="yes" size="4" pos="26" show="192.168.0.104" value="c0a80068"/>
    <field name="ip.src_host" showname="Source Host: 192.168.0.104" hide="yes" size="4" pos="26" show="192.168.0.104" value="c0a80068"/>
    <field name="ip.host" showname="Source or Destination Host: 192.168.0.104" hide="yes" size="4" pos="26" show="192.168.0.104" value="c0a80068"/>
    <field name="ip.dst" showname="Destination: 69.167.162.200 (69.167.162.200)" size="4" pos="30" show="69.167.162.200" value="45a7a2c8"/>
    <field name="ip.addr" showname="Source or Destination Address: 69.167.162.200 (69.167.162.200)" hide="yes" size="4" pos="30" show="69.167.162.200" value="45a7a2c8"/>
    <field name="ip.dst_host" showname="Destination Host: 69.167.162.200" hide="yes" size="4" pos="30" show="69.167.162.200" value="45a7a2c8"/>
    <field name="ip.host" showname="Source or Destination Host: 69.167.162.200" hide="yes" size="4" pos="30" show="69.167.162.200" value="45a7a2c8"/>
  </proto>
  <proto name="tcp" showname="Transmission Control Protocol, Src Port: 45009 (45009), Dst Port: 2379 (2379), Seq: 0, Len: 0" size="40" pos="34">
    <field name="tcp.srcport" showname="Source port: 45009 (45009)" size="2" pos="34" show="45009" value="afd1"/>
    <field name="tcp.dstport" showname="Destination port: 2379 (2379)" size="2" pos="36" show="2379" value="094b"/>
    <field name="tcp.port" showname="Source or Destination Port: 45009" hide="yes" size="2" pos="34" show="45009" value="afd1"/>
    <field name="tcp.port" showname="Source or Destination Port: 2379" hide="yes" size="2" pos="36" show="2379" value="094b"/>
    <field name="tcp.stream" showname="Stream index: 0" size="0" pos="34" show="0"/>
    <field name="tcp.len" showname="TCP Segment Len: 0" hide="yes" size="1" pos="46" show="0" value="a0"/>
    <field name="tcp.seq" showname="Sequence number: 0    (relative sequence number)" size="4" pos="38" show="0" value="6cd34cf5"/>
    <field name="tcp.hdr_len" showname="Header length: 40 bytes" size="1" pos="46" show="40" value="a0"/>
    <field name="tcp.flags" showname="Flags: 0x002 (SYN)" size="2" pos="46" show="0x0002" value="2" unmaskedvalue="a002">
      <field name="tcp.flags.res" showname="000. .... .... = Reserved: Not set" size="1" pos="46" show="0" value="0" unmaskedvalue="a0"/>
      <field name="tcp.flags.ns" showname="...0 .... .... = Nonce: Not set" size="1" pos="46" show="0" value="0" unmaskedvalue="a0"/>
      <field name="tcp.flags.cwr" showname=".... 0... .... = Congestion Window Reduced (CWR): Not set" size="1" pos="47" show="0" value="0" unmaskedvalue="02"/>
      <field name="tcp.flags.ecn" showname=".... .0.. .... = ECN-Echo: Not set" size="1" pos="47" show="0" value="0" unmaskedvalue="02"/>
      <field name="tcp.flags.urg" showname=".... ..0. .... = Urgent: Not set" size="1" pos="47" show="0" value="0" unmaskedvalue="02"/>
      <field name="tcp.flags.ack" showname=".... ...0 .... = Acknowledgment: Not set" size="1" pos="47" show="0" value="0" unmaskedvalue="02"/>
      <field name="tcp.flags.push" showname=".... .... 0... = Push: Not set" size="1" pos="47" show="0" value="0" unmaskedvalue="02"/>
      <field name="tcp.flags.reset" showname=".... .... .0.. = Reset: Not set" size="1" pos="47" show="0" value="0" unmaskedvalue="02"/>
      <field name="tcp.flags.syn" showname=".... .... ..1. = Syn: Set" size="1" pos="47" show="1" value="1" unmaskedvalue="02">
        <field name="expert" showname="Expert Info (Chat/Sequence): Connection establish request (SYN): server port 2379" size="0" pos="47">
          <field name="expert.message" showname="Message: Connection establish request (SYN): server port 2379" size="0" pos="0" show="Connection establish request (SYN): server port 2379"/>
          <field name="expert.severity" showname="Severity level: Chat" size="0" pos="0" show="Chat"/>
          <field name="expert.group" showname="Group: Sequence" size="0" pos="0" show="Sequence"/>
        </field>
      </field>
      <field name="tcp.flags.fin" showname=".... .... ...0 = Fin: Not set" size="1" pos="47" show="0" value="0" unmaskedvalue="02"/>
    </field>
    <field name="tcp.window_size_value" showname="Window size value: 14600" size="2" pos="48" show="14600" value="3908"/>
    <field name="tcp.window_size" showname="Calculated window size: 14600" size="2" pos="48" show="14600" value="3908"/>
    <field name="tcp.checksum" showname="Checksum: 0xa9ae [validation disabled]" size="2" pos="50" show="0xa9ae" value="a9ae">
      <field name="tcp.checksum_good" showname="Good Checksum: False" size="2" pos="50" show="0" value="a9ae"/>
      <field name="tcp.checksum_bad" showname="Bad Checksum: False" size="2" pos="50" show="0" value="a9ae"/>
    </field>
    <field name="tcp.options" showname="Options: (20 bytes), Maximum segment size, SACK permitted, Timestamps, No-Operation (NOP), Window scale" size="20" pos="54" show="02:04:05:b4:04:02:08:0a:00:06:a0:a5:00:00:00:00:01:03:03:04" value="020405b40402080a0006a0a50000000001030304">
      <field name="tcp.options.mss" showname="Maximum segment size: 1460 bytes" size="4" pos="54" show="" value="">
        <field name="tcp.option_kind" showname="Kind: MSS size (2)" size="1" pos="54" show="2" value="02"/>
        <field name="tcp.option_len" showname="Length: 4" size="1" pos="55" show="4" value="04"/>
        <field name="tcp.options.mss_val" showname="MSS Value: 1460" size="2" pos="56" show="1460" value="05b4"/>
      </field>
      <field name="tcp.options.sack_perm" showname="TCP SACK Permitted Option: True" size="2" pos="58" show="1" value="0402">
        <field name="tcp.option_kind" showname="Kind: SACK Permission (4)" size="1" pos="58" show="4" value="04"/>
        <field name="tcp.option_len" showname="Length: 2" size="1" pos="59" show="2" value="02"/>
      </field>
      <field name="" show="Timestamps: TSval 434341, TSecr 0" size="10" pos="60" value="080a0006a0a500000000">
        <field name="tcp.option_kind" showname="Kind: Timestamp (8)" size="1" pos="60" show="8" value="08"/>
        <field name="tcp.option_len" showname="Length: 10" size="1" pos="61" show="10" value="0a"/>
        <field name="tcp.options.timestamp.tsval" showname="Timestamp value: 434341" size="4" pos="62" show="434341" value="0006a0a5"/>
        <field name="tcp.options.timestamp.tsecr" showname="Timestamp echo reply: 0" size="4" pos="66" show="0" value="00000000"/>
      </field>
      <field name="" show="No-Operation (NOP)" size="1" pos="70" value="01">
        <field name="ip.opt.type" showname="Type: 1" size="1" pos="70" show="1" value="01">
          <field name="ip.opt.type.copy" showname="0... .... = Copy on fragmentation: No" size="1" pos="70" show="0" value="0" unmaskedvalue="01"/>
          <field name="ip.opt.type.class" showname=".00. .... = Class: Control (0)" size="1" pos="70" show="0" value="0" unmaskedvalue="01"/>
          <field name="ip.opt.type.number" showname="...0 0001 = Number: No-Operation (NOP) (1)" size="1" pos="70" show="1" value="1" unmaskedvalue="01"/>
        </field>
      </field>
      <field name="" show="Window scale: 4 (multiply by 16)" size="3" pos="71" value="030304">
        <field name="tcp.option_kind" showname="Kind: Window Scale (3)" size="1" pos="71" show="3" value="03"/>
        <field name="tcp.option_len" showname="Length: 3" size="1" pos="72" show="3" value="03"/>
        <field name="tcp.options.wscale.shift" showname="Shift count: 4" size="1" pos="73" show="4" value="04"/>
        <field name="tcp.options.wscale.multiplier" showname="Multiplier: 16" size="1" pos="73" show="16" value="04"/>
      </field>
    </field>
  </proto>
</packet>

<packet>
  <proto name="geninfo" pos="0" showname="General information" size="74">
    <field name="num" pos="0" show="2" showname="Number" value="2" size="74"/>
    <field name="len" pos="0" show="74" showname="Frame Length" value="4a" size="74"/>
    <field name="caplen" pos="0" show="74" showname="Captured Length" value="4a" size="74"/>
    <field name="timestamp" pos="0" show="Jan  7, 2013 14:30:18.391112000 CST" showname="Captured Time" value="1357590618.391112000" size="74"/>
  </proto>
  <proto name="frame" showname="Frame 2: 74 bytes on wire (592 bits), 74 bytes captured (592 bits)" size="74" pos="0">
    <field name="frame.dlt" showname="WTAP_ENCAP: 1" size="0" pos="0" show="1"/>
    <field name="frame.time" showname="Arrival Time: Jan  7, 2013 14:30:18.391112000 CST" size="0" pos="0" show="Jan  7, 2013 14:30:18.391112000"/>
    <field name="frame.offset_shift" showname="Time shift for this packet: 0.000000000 seconds" size="0" pos="0" show="0.000000000"/>
    <field name="frame.time_epoch" showname="Epoch Time: 1357590618.391112000 seconds" size="0" pos="0" show="1357590618.391112000"/>
    <field name="frame.time_delta" showname="Time delta from previous captured frame: 0.011609000 seconds" size="0" pos="0" show="0.011609000"/>
    <field name="frame.time_delta_displayed" showname="Time delta from previous displayed frame: 0.011609000 seconds" size="0" pos="0" show="0.011609000"/>
    <field name="frame.time_relative" showname="Time since reference or first frame: 0.011609000 seconds" size="0" pos="0" show="0.011609000"/>
    <field name="frame.number" showname="Frame Number: 2" size="0" pos="0" show="2"/>
    <field name="frame.len" showname="Frame Length: 74 bytes (592 bits)" size="0" pos="0" show="74"/>
    <field name="frame.cap_len" showname="Capture Length: 74 bytes (592 bits)" size="0" pos="0" show="74"/>
    <field name="frame.marked" showname="Frame is marked: False" size="0" pos="0" show="0"/>
    <field name="frame.ignored" showname="Frame is ignored: False" size="0" pos="0" show="0"/>
    <field name="frame.protocols" showname="Protocols in frame: eth:ip:tcp" size="0" pos="0" show="eth:ip:tcp"/>
    <field name="frame.coloring_rule.name" showname="Coloring Rule Name: TCP SYN/FIN" size="0" pos="0" show="TCP SYN/FIN"/>
    <field name="frame.coloring_rule.string" showname="Coloring Rule String: tcp.flags &amp; 0x02 || tcp.flags.fin == 1" size="0" pos="0" show="tcp.flags &amp; 0x02 || tcp.flags.fin == 1"/>
  </proto>
  <proto name="eth" showname="Ethernet II, Src: Cisco_82:44:2f (00:13:c4:82:44:2f), Dst: QuantaCo_aa:bb:43 (c8:0a:a9:aa:bb:43)" size="14" pos="0">
    <field name="eth.dst" showname="Destination: QuantaCo_aa:bb:43 (c8:0a:a9:aa:bb:43)" size="6" pos="0" show="c8:0a:a9:aa:bb:43" value="c80aa9aabb43">
      <field name="eth.addr" showname="Address: QuantaCo_aa:bb:43 (c8:0a:a9:aa:bb:43)" size="6" pos="0" show="c8:0a:a9:aa:bb:43" value="c80aa9aabb43"/>
      <field name="eth.lg" showname=".... ..0. .... .... .... .... = LG bit: Globally unique address (factory default)" size="3" pos="0" show="0" value="0" unmaskedvalue="c80aa9"/>
      <field name="eth.ig" showname=".... ...0 .... .... .... .... = IG bit: Individual address (unicast)" size="3" pos="0" show="0" value="0" unmaskedvalue="c80aa9"/>
    </field>
    <field name="eth.src" showname="Source: Cisco_82:44:2f (00:13:c4:82:44:2f)" size="6" pos="6" show="00:13:c4:82:44:2f" value="0013c482442f">
      <field name="eth.addr" showname="Address: Cisco_82:44:2f (00:13:c4:82:44:2f)" size="6" pos="6" show="00:13:c4:82:44:2f" value="0013c482442f"/>
      <field name="eth.lg" showname=".... ..0. .... .... .... .... = LG bit: Globally unique address (factory default)" size="3" pos="6" show="0" value="0" unmaskedvalue="0013c4"/>
      <field name="eth.ig" showname=".... ...0 .... .... .... .... = IG bit: Individual address (unicast)" size="3" pos="6" show="0" value="0" unmaskedvalue="0013c4"/>
    </field>
    <field name="eth.type" showname="Type: IP (0x0800)" size="2" pos="12" show="0x0800" value="0800"/>
  </proto>
  <proto name="ip" showname="Internet Protocol Version 4, Src: 69.167.162.200 (69.167.162.200), Dst: 192.168.0.104 (192.168.0.104)" size="20" pos="14">
    <field name="ip.version" showname="Version: 4" size="1" pos="14" show="4" value="45"/>
    <field name="ip.hdr_len" showname="Header length: 20 bytes" size="1" pos="14" show="20" value="45"/>
    <field name="ip.dsfield" showname="Differentiated Services Field: 0x00 (DSCP 0x00: Default; ECN: 0x00: Not-ECT (Not ECN-Capable Transport))" size="1" pos="15" show="0" value="00">
      <field name="ip.dsfield.dscp" showname="0000 00.. = Differentiated Services Codepoint: Default (0x00)" size="1" pos="15" show="0x00" value="0" unmaskedvalue="00"/>
      <field name="ip.dsfield.ecn" showname=".... ..00 = Explicit Congestion Notification: Not-ECT (Not ECN-Capable Transport) (0x00)" size="1" pos="15" show="0x00" value="0" unmaskedvalue="00"/>
    </field>
    <field name="ip.len" showname="Total Length: 60" size="2" pos="16" show="60" value="003c"/>
    <field name="ip.id" showname="Identification: 0x0000 (0)" size="2" pos="18" show="0x0000" value="0000"/>
    <field name="ip.flags" showname="Flags: 0x02 (Don&apos;t Fragment)" size="1" pos="20" show="0x02" value="40">
      <field name="ip.flags.rb" showname="0... .... = Reserved bit: Not set" size="1" pos="20" show="0" value="40"/>
      <field name="ip.flags.df" showname=".1.. .... = Don&apos;t fragment: Set" size="1" pos="20" show="1" value="40"/>
      <field name="ip.flags.mf" showname="..0. .... = More fragments: Not set" size="1" pos="20" show="0" value="40"/>
    </field>
    <field name="ip.frag_offset" showname="Fragment offset: 0" size="2" pos="20" show="0" value="4000"/>
    <field name="ip.ttl" showname="Time to live: 53" size="1" pos="22" show="53" value="35"/>
    <field name="ip.proto" showname="Protocol: TCP (6)" size="1" pos="23" show="6" value="06"/>
    <field name="ip.checksum" showname="Header checksum: 0x9c3c [correct]" size="2" pos="24" show="0x9c3c" value="9c3c">
      <field name="ip.checksum_good" showname="Good: True" size="2" pos="24" show="1" value="9c3c"/>
      <field name="ip.checksum_bad" showname="Bad: False" size="2" pos="24" show="0" value="9c3c"/>
    </field>
    <field name="ip.src" showname="Source: 69.167.162.200 (69.167.162.200)" size="4" pos="26" show="69.167.162.200" value="45a7a2c8"/>
    <field name="ip.addr" showname="Source or Destination Address: 69.167.162.200 (69.167.162.200)" hide="yes" size="4" pos="26" show="69.167.162.200" value="45a7a2c8"/>
    <field name="ip.src_host" showname="Source Host: 69.167.162.200" hide="yes" size="4" pos="26" show="69.167.162.200" value="45a7a2c8"/>
    <field name="ip.host" showname="Source or Destination Host: 69.167.162.200" hide="yes" size="4" pos="26" show="69.167.162.200" value="45a7a2c8"/>
    <field name="ip.dst" showname="Destination: 192.168.0.104 (192.168.0.104)" size="4" pos="30" show="192.168.0.104" value="c0a80068"/>
    <field name="ip.addr" showname="Source or Destination Address: 192.168.0.104 (192.168.0.104)" hide="yes" size="4" pos="30" show="192.168.0.104" value="c0a80068"/>
    <field name="ip.dst_host" showname="Destination Host: 192.168.0.104" hide="yes" size="4" pos="30" show="192.168.0.104" value="c0a80068"/>
    <field name="ip.host" showname="Source or Destination Host: 192.168.0.104" hide="yes" size="4" pos="30" show="192.168.0.104" value="c0a80068"/>
  </proto>
  <proto name="tcp" showname="Transmission Control Protocol, Src Port: 2379 (2379), Dst Port: 45009 (45009), Seq: 0, Ack: 1, Len: 0" size="40" pos="34">
    <field name="tcp.srcport" showname="Source port: 2379 (2379)" size="2" pos="34" show="2379" value="094b"/>
    <field name="tcp.dstport" showname="Destination port: 45009 (45009)" size="2" pos="36" show="45009" value="afd1"/>
    <field name="tcp.port" showname="Source or Destination Port: 2379" hide="yes" size="2" pos="34" show="2379" value="094b"/>
    <field name="tcp.port" showname="Source or Destination Port: 45009" hide="yes" size="2" pos="36" show="45009" value="afd1"/>
    <field name="tcp.stream" showname="Stream index: 0" size="0" pos="34" show="0"/>
    <field name="tcp.len" showname="TCP Segment Len: 0" hide="yes" size="1" pos="46" show="0" value="a0"/>
    <field name="tcp.seq" showname="Sequence number: 0    (relative sequence number)" size="4" pos="38" show="0" value="6d31bd51"/>
    <field name="tcp.ack" showname="Acknowledgment number: 1    (relative ack number)" size="4" pos="42" show="1" value="6cd34cf6"/>
    <field name="tcp.hdr_len" showname="Header length: 40 bytes" size="1" pos="46" show="40" value="a0"/>
    <field name="tcp.flags" showname="Flags: 0x012 (SYN, ACK)" size="2" pos="46" show="0x0012" value="12" unmaskedvalue="a012">
      <field name="tcp.flags.res" showname="000. .... .... = Reserved: Not set" size="1" pos="46" show="0" value="0" unmaskedvalue="a0"/>
      <field name="tcp.flags.ns" showname="...0 .... .... = Nonce: Not set" size="1" pos="46" show="0" value="0" unmaskedvalue="a0"/>
      <field name="tcp.flags.cwr" showname=".... 0... .... = Congestion Window Reduced (CWR): Not set" size="1" pos="47" show="0" value="0" unmaskedvalue="12"/>
      <field name="tcp.flags.ecn" showname=".... .0.. .... = ECN-Echo: Not set" size="1" pos="47" show="0" value="0" unmaskedvalue="12"/>
      <field name="tcp.flags.urg" showname=".... ..0. .... = Urgent: Not set" size="1" pos="47" show="0" value="0" unmaskedvalue="12"/>
      <field name="tcp.flags.ack" showname=".... ...1 .... = Acknowledgment: Set" size="1" pos="47" show="1" value="1" unmaskedvalue="12"/>
      <field name="tcp.flags.push" showname=".... .... 0... = Push: Not set" size="1" pos="47" show="0" value="0" unmaskedvalue="12"/>
      <field name="tcp.flags.reset" showname=".... .... .0.. = Reset: Not set" size="1" pos="47" show="0" value="0" unmaskedvalue="12"/>
      <field name="tcp.flags.syn" showname=".... .... ..1. = Syn: Set" size="1" pos="47" show="1" value="1" unmaskedvalue="12">
        <field name="expert" showname="Expert Info (Chat/Sequence): Connection establish acknowledge (SYN+ACK): server port 2379" size="0" pos="47">
          <field name="expert.message" showname="Message: Connection establish acknowledge (SYN+ACK): server port 2379" size="0" pos="0" show="Connection establish acknowledge (SYN+ACK): server port 2379"/>
          <field name="expert.severity" showname="Severity level: Chat" size="0" pos="0" show="Chat"/>
          <field name="expert.group" showname="Group: Sequence" size="0" pos="0" show="Sequence"/>
        </field>
      </field>
      <field name="tcp.flags.fin" showname=".... .... ...0 = Fin: Not set" size="1" pos="47" show="0" value="0" unmaskedvalue="12"/>
    </field>
    <field name="tcp.window_size_value" showname="Window size value: 11584" size="2" pos="48" show="11584" value="2d40"/>
    <field name="tcp.window_size" showname="Calculated window size: 11584" size="2" pos="48" show="11584" value="2d40"/>
    <field name="tcp.checksum" showname="Checksum: 0x9872 [validation disabled]" size="2" pos="50" show="0x9872" value="9872">
      <field name="tcp.checksum_good" showname="Good Checksum: False" size="2" pos="50" show="0" value="9872"/>
      <field name="tcp.checksum_bad" showname="Bad Checksum: False" size="2" pos="50" show="0" value="9872"/>
    </field>
    <field name="tcp.options" showname="Options: (20 bytes), Maximum segment size, SACK permitted, Timestamps, No-Operation (NOP), Window scale" size="20" pos="54" show="02:04:05:b4:04:02:08:0a:d6:0d:c4:9a:00:06:a0:a5:01:03:03:07" value="020405b40402080ad60dc49a0006a0a501030307">
      <field name="tcp.options.mss" showname="Maximum segment size: 1460 bytes" size="4" pos="54" show="" value="">
        <field name="tcp.option_kind" showname="Kind: MSS size (2)" size="1" pos="54" show="2" value="02"/>
        <field name="tcp.option_len" showname="Length: 4" size="1" pos="55" show="4" value="04"/>
        <field name="tcp.options.mss_val" showname="MSS Value: 1460" size="2" pos="56" show="1460" value="05b4"/>
      </field>
      <field name="tcp.options.sack_perm" showname="TCP SACK Permitted Option: True" size="2" pos="58" show="1" value="0402">
        <field name="tcp.option_kind" showname="Kind: SACK Permission (4)" size="1" pos="58" show="4" value="04"/>
        <field name="tcp.option_len" showname="Length: 2" size="1" pos="59" show="2" value="02"/>
      </field>
      <field name="" show="Timestamps: TSval 3591226522, TSecr 434341" size="10" pos="60" value="080ad60dc49a0006a0a5">
        <field name="tcp.option_kind" showname="Kind: Timestamp (8)" size="1" pos="60" show="8" value="08"/>
        <field name="tcp.option_len" showname="Length: 10" size="1" pos="61" show="10" value="0a"/>
        <field name="tcp.options.timestamp.tsval" showname="Timestamp value: 3591226522" size="4" pos="62" show="3591226522" value="d60dc49a"/>
        <field name="tcp.options.timestamp.tsecr" showname="Timestamp echo reply: 434341" size="4" pos="66" show="434341" value="0006a0a5"/>
      </field>
      <field name="" show="No-Operation (NOP)" size="1" pos="70" value="01">
        <field name="ip.opt.type" showname="Type: 1" size="1" pos="70" show="1" value="01">
          <field name="ip.opt.type.copy" showname="0... .... = Copy on fragmentation: No" size="1" pos="70" show="0" value="0" unmaskedvalue="01"/>
          <field name="ip.opt.type.class" showname=".00. .... = Class: Control (0)" size="1" pos="70" show="0" value="0" unmaskedvalue="01"/>
          <field name="ip.opt.type.number" showname="...0 0001 = Number: No-Operation (NOP) (1)" size="1" pos="70" show="1" value="1" unmaskedvalue="01"/>
        </field>
      </field>
      <field name="" show="Window scale: 7 (multiply by 128)" size="3" pos="71" value="030307">
        <field name="tcp.option_kind" showname="Kind: Window Scale (3)" size="1" pos="71" show="3" value="03"/>
        <field name="tcp.option_len" showname="Length: 3" size="1" pos="72" show="3" value="03"/>
        <field name="tcp.options.wscale.shift" showname="Shift count: 7" size="1" pos="73" show="7" value="07"/>
        <field name="tcp.options.wscale.multiplier" showname="Multiplier: 128" size="1" pos="73" show="128" value="07"/>
      </field>
    </field>
    <field name="tcp.analysis" showname="SEQ/ACK analysis" size="0" pos="34" show="" value="">
      <field name="tcp.analysis.acks_frame" showname="This is an ACK to the segment in frame: 1" size="0" pos="34" show="1"/>
      <field name="tcp.analysis.ack_rtt" showname="The RTT to ACK the segment was: 0.011609000 seconds" size="0" pos="34" show="0.011609000"/>
    </field>
  </proto>
</packet>

<packet>
  <proto name="geninfo" pos="0" showname="General information" size="66">
    <field name="num" pos="0" show="3" showname="Number" value="3" size="66"/>
    <field name="len" pos="0" show="66" showname="Frame Length" value="42" size="66"/>
    <field name="caplen" pos="0" show="66" showname="Captured Length" value="42" size="66"/>
    <field name="timestamp" pos="0" show="Jan  7, 2013 14:30:18.391157000 CST" showname="Captured Time" value="1357590618.391157000" size="66"/>
  </proto>
  <proto name="frame" showname="Frame 3: 66 bytes on wire (528 bits), 66 bytes captured (528 bits)" size="66" pos="0">
    <field name="frame.dlt" showname="WTAP_ENCAP: 1" size="0" pos="0" show="1"/>
    <field name="frame.time" showname="Arrival Time: Jan  7, 2013 14:30:18.391157000 CST" size="0" pos="0" show="Jan  7, 2013 14:30:18.391157000"/>
    <field name="frame.offset_shift" showname="Time shift for this packet: 0.000000000 seconds" size="0" pos="0" show="0.000000000"/>
    <field name="frame.time_epoch" showname="Epoch Time: 1357590618.391157000 seconds" size="0" pos="0" show="1357590618.391157000"/>
    <field name="frame.time_delta" showname="Time delta from previous captured frame: 0.000045000 seconds" size="0" pos="0" show="0.000045000"/>
    <field name="frame.time_delta_displayed" showname="Time delta from previous displayed frame: 0.000045000 seconds" size="0" pos="0" show="0.000045000"/>
    <field name="frame.time_relative" showname="Time since reference or first frame: 0.011654000 seconds" size="0" pos="0" show="0.011654000"/>
    <field name="frame.number" showname="Frame Number: 3" size="0" pos="0" show="3"/>
    <field name="frame.len" showname="Frame Length: 66 bytes (528 bits)" size="0" pos="0" show="66"/>
    <field name="frame.cap_len" showname="Capture Length: 66 bytes (528 bits)" size="0" pos="0" show="66"/>
    <field name="frame.marked" showname="Frame is marked: False" size="0" pos="0" show="0"/>
    <field name="frame.ignored" showname="Frame is ignored: False" size="0" pos="0" show="0"/>
    <field name="frame.protocols" showname="Protocols in frame: eth:ip:tcp" size="0" pos="0" show="eth:ip:tcp"/>
    <field name="frame.coloring_rule.name" showname="Coloring Rule Name: TCP" size="0" pos="0" show="TCP"/>
    <field name="frame.coloring_rule.string" showname="Coloring Rule String: tcp" size="0" pos="0" show="tcp"/>
  </proto>
  <proto name="eth" showname="Ethernet II, Src: QuantaCo_aa:bb:43 (c8:0a:a9:aa:bb:43), Dst: Cisco_82:44:2f (00:13:c4:82:44:2f)" size="14" pos="0">
    <field name="eth.dst" showname="Destination: Cisco_82:44:2f (00:13:c4:82:44:2f)" size="6" pos="0" show="00:13:c4:82:44:2f" value="0013c482442f">
      <field name="eth.addr" showname="Address: Cisco_82:44:2f (00:13:c4:82:44:2f)" size="6" pos="0" show="00:13:c4:82:44:2f" value="0013c482442f"/>
      <field name="eth.lg" showname=".... ..0. .... .... .... .... = LG bit: Globally unique address (factory default)" size="3" pos="0" show="0" value="0" unmaskedvalue="0013c4"/>
      <field name="eth.ig" showname=".... ...0 .... .... .... .... = IG bit: Individual address (unicast)" size="3" pos="0" show="0" value="0" unmaskedvalue="0013c4"/>
    </field>
    <field name="eth.src" showname="Source: QuantaCo_aa:bb:43 (c8:0a:a9:aa:bb:43)" size="6" pos="6" show="c8:0a:a9:aa:bb:43" value="c80aa9aabb43">
      <field name="eth.addr" showname="Address: QuantaCo_aa:bb:43 (c8:0a:a9:aa:bb:43)" size="6" pos="6" show="c8:0a:a9:aa:bb:43" value="c80aa9aabb43"/>
      <field name="eth.lg" showname=".... ..0. .... .... .... .... = LG bit: Globally unique address (factory default)" size="3" pos="6" show="0" value="0" unmaskedvalue="c80aa9"/>
      <field name="eth.ig" showname=".... ...0 .... .... .... .... = IG bit: Individual address (unicast)" size="3" pos="6" show="0" value="0" unmaskedvalue="c80aa9"/>
    </field>
    <field name="eth.type" showname="Type: IP (0x0800)" size="2" pos="12" show="0x0800" value="0800"/>
  </proto>
  <proto name="ip" showname="Internet Protocol Version 4, Src: 192.168.0.104 (192.168.0.104), Dst: 69.167.162.200 (69.167.162.200)" size="20" pos="14">
    <field name="ip.version" showname="Version: 4" size="1" pos="14" show="4" value="45"/>
    <field name="ip.hdr_len" showname="Header length: 20 bytes" size="1" pos="14" show="20" value="45"/>
    <field name="ip.dsfield" showname="Differentiated Services Field: 0x00 (DSCP 0x00: Default; ECN: 0x00: Not-ECT (Not ECN-Capable Transport))" size="1" pos="15" show="0" value="00">
      <field name="ip.dsfield.dscp" showname="0000 00.. = Differentiated Services Codepoint: Default (0x00)" size="1" pos="15" show="0x00" value="0" unmaskedvalue="00"/>
      <field name="ip.dsfield.ecn" showname=".... ..00 = Explicit Congestion Notification: Not-ECT (Not ECN-Capable Transport) (0x00)" size="1" pos="15" show="0x00" value="0" unmaskedvalue="00"/>
    </field>
    <field name="ip.len" showname="Total Length: 52" size="2" pos="16" show="52" value="0034"/>
    <field name="ip.id" showname="Identification: 0xec51 (60497)" size="2" pos="18" show="0xec51" value="ec51"/>
    <field name="ip.flags" showname="Flags: 0x02 (Don&apos;t Fragment)" size="1" pos="20" show="0x02" value="40">
      <field name="ip.flags.rb" showname="0... .... = Reserved bit: Not set" size="1" pos="20" show="0" value="40"/>
      <field name="ip.flags.df" showname=".1.. .... = Don&apos;t fragment: Set" size="1" pos="20" show="1" value="40"/>
      <field name="ip.flags.mf" showname="..0. .... = More fragments: Not set" size="1" pos="20" show="0" value="40"/>
    </field>
    <field name="ip.frag_offset" showname="Fragment offset: 0" size="2" pos="20" show="0" value="4000"/>
    <field name="ip.ttl" showname="Time to live: 64" size="1" pos="22" show="64" value="40"/>
    <field name="ip.proto" showname="Protocol: TCP (6)" size="1" pos="23" show="6" value="06"/>
    <field name="ip.checksum" showname="Header checksum: 0xa4f2 [correct]" size="2" pos="24" show="0xa4f2" value="a4f2">
      <field name="ip.checksum_good" showname="Good: True" size="2" pos="24" show="1" value="a4f2"/>
      <field name="ip.checksum_bad" showname="Bad: False" size="2" pos="24" show="0" value="a4f2"/>
    </field>
    <field name="ip.src" showname="Source: 192.168.0.104 (192.168.0.104)" size="4" pos="26" show="192.168.0.104" value="c0a80068"/>
    <field name="ip.addr" showname="Source or Destination Address: 192.168.0.104 (192.168.0.104)" hide="yes" size="4" pos="26" show="192.168.0.104" value="c0a80068"/>
    <field name="ip.src_host" showname="Source Host: 192.168.0.104" hide="yes" size="4" pos="26" show="192.168.0.104" value="c0a80068"/>
    <field name="ip.host" showname="Source or Destination Host: 192.168.0.104" hide="yes" size="4" pos="26" show="192.168.0.104" value="c0a80068"/>
    <field name="ip.dst" showname="Destination: 69.167.162.200 (69.167.162.200)" size="4" pos="30" show="69.167.162.200" value="45a7a2c8"/>
    <field name="ip.addr" showname="Source or Destination Address: 69.167.162.200 (69.167.162.200)" hide="yes" size="4" pos="30" show="69.167.162.200" value="45a7a2c8"/>
    <field name="ip.dst_host" showname="Destination Host: 69.167.162.200" hide="yes" size="4" pos="30" show="69.167.162.200" value="45a7a2c8"/>
    <field name="ip.host" showname="Source or Destination Host: 69.167.162.200" hide="yes" size="4" pos="30" show="69.167.162.200" value="45a7a2c8"/>
  </proto>
  <proto name="tcp" showname="Transmission Control Protocol, Src Port: 45009 (45009), Dst Port: 2379 (2379), Seq: 1, Ack: 1, Len: 0" size="32" pos="34">
    <field name="tcp.srcport" showname="Source port: 45009 (45009)" size="2" pos="34" show="45009" value="afd1"/>
    <field name="tcp.dstport" showname="Destination port: 2379 (2379)" size="2" pos="36" show="2379" value="094b"/>
    <field name="tcp.port" showname="Source or Destination Port: 45009" hide="yes" size="2" pos="34" show="45009" value="afd1"/>
    <field name="tcp.port" showname="Source or Destination Port: 2379" hide="yes" size="2" pos="36" show="2379" value="094b"/>
    <field name="tcp.stream" showname="Stream index: 0" size="0" pos="34" show="0"/>
    <field name="tcp.len" showname="TCP Segment Len: 0" hide="yes" size="1" pos="46" show="0" value="80"/>
    <field name="tcp.seq" showname="Sequence number: 1    (relative sequence number)" size="4" pos="38" show="1" value="6cd34cf6"/>
    <field name="tcp.ack" showname="Acknowledgment number: 1    (relative ack number)" size="4" pos="42" show="1" value="6d31bd52"/>
    <field name="tcp.hdr_len" showname="Header length: 32 bytes" size="1" pos="46" show="32" value="80"/>
    <field name="tcp.flags" showname="Flags: 0x010 (ACK)" size="2" pos="46" show="0x0010" value="10" unmaskedvalue="8010">
      <field name="tcp.flags.res" showname="000. .... .... = Reserved: Not set" size="1" pos="46" show="0" value="0" unmaskedvalue="80"/>
      <field name="tcp.flags.ns" showname="...0 .... .... = Nonce: Not set" size="1" pos="46" show="0" value="0" unmaskedvalue="80"/>
      <field name="tcp.flags.cwr" showname=".... 0... .... = Congestion Window Reduced (CWR): Not set" size="1" pos="47" show="0" value="0" unmaskedvalue="10"/>
      <field name="tcp.flags.ecn" showname=".... .0.. .... = ECN-Echo: Not set" size="1" pos="47" show="0" value="0" unmaskedvalue="10"/>
      <field name="tcp.flags.urg" showname=".... ..0. .... = Urgent: Not set" size="1" pos="47" show="0" value="0" unmaskedvalue="10"/>
      <field name="tcp.flags.ack" showname=".... ...1 .... = Acknowledgment: Set" size="1" pos="47" show="1" value="1" unmaskedvalue="10"/>
      <field name="tcp.flags.push" showname=".... .... 0... = Push: Not set" size="1" pos="47" show="0" value="0" unmaskedvalue="10"/>
      <field name="tcp.flags.reset" showname=".... .... .0.. = Reset: Not set" size="1" pos="47" show="0" value="0" unmaskedvalue="10"/>
      <field name="tcp.flags.syn" showname=".... .... ..0. = Syn: Not set" size="1" pos="47" show="0" value="0" unmaskedvalue="10"/>
      <field name="tcp.flags.fin" showname=".... .... ...0 = Fin: Not set" size="1" pos="47" show="0" value="0" unmaskedvalue="10"/>
    </field>
    <field name="tcp.window_size_value" showname="Window size value: 913" size="2" pos="48" show="913" value="0391"/>
    <field name="tcp.window_size" showname="Calculated window size: 14608" size="2" pos="48" show="14608" value="0391"/>
    <field name="tcp.window_size_scalefactor" showname="Window size scaling factor: 16" size="2" pos="48" show="16" value="0391"/>
    <field name="tcp.checksum" showname="Checksum: 0xa9a6 [validation disabled]" size="2" pos="50" show="0xa9a6" value="a9a6">
      <field name="tcp.checksum_good" showname="Good Checksum: False" size="2" pos="50" show="0" value="a9a6"/>
